{
  "schema_version": "1",
  "command_id": "cmd-unsupported",
  "tenant_id": "tenant-demo",
  "device_id": "esp32-demo",
  "session_id": "session-demo",
  "capability": "lock.unlock",
  "arguments": {
    "on": false
  },
  "issued_at": 1000,
  "expires_at": 1060,
  "idempotency_key": "session-demo:cmd-unsupported"
}
