{
  "schema_version": "1",
  "command_id": "cmd-expired",
  "tenant_id": "tenant-demo",
  "device_id": "esp32-demo",
  "session_id": "session-demo",
  "capability": "lamp.set_power",
  "arguments": {"on": true},
  "issued_at": 1000,
  "expires_at": 1060,
  "idempotency_key": "session-demo:cmd-expired"
}
