{
  "schema_version": "1",
  "command_id": "cmd-extra",
  "tenant_id": "tenant-demo",
  "device_id": "esp32-demo",
  "session_id": "session-demo",
  "capability": "lamp.set_power",
  "arguments": {
    "on": true,
    "unexpected": "injected"
  },
  "issued_at": 1000,
  "expires_at": 1060,
  "idempotency_key": "session-demo:cmd-extra"
}
